<?xml version="1.0" encoding="UTF-8" standalone="no"?>
<?xml-stylesheet type="text/css" href="style.css"?>
<!DOCTYPE university SYSTEM "student.dtd">

<university>
<student first-name="Gordon" last-name="Sumner">
  <name>
    <first-name>Gordon</first-name>
    <middle-name>Matthew</middle-name>
    <last-name>Sumner</last-name>
    <preferred-name>Sting</preferred-name>
  </name>
  <contact>
    <email>sting@thepolice.com</email>
    <phone>212.123.4567</phone>
  </contact>
  <program-info>
    <major>Music</major>
    <minor>English</minor>
    <advisor>Andy Summers</advisor>
  </program-info>
  <academics-info>
    <id>1234567</id>
    <GPA>4.0</GPA>
    <progression-status>first year</progression-status>
    <status>full-time</status>
    <intial-enrollment>08-25-1969</intial-enrollment>
    <graduation-date>05-01-1973</graduation-date>
  </academics-info>
</student>
  <student first-name="Kim" last-name="Thayil">
    <name>
      <first-name>Kim</first-name>
      <middle-name></middle-name>
      <last-name>Thayil</last-name>
      <preferred-name></preferred-name>
    </name>
    <contact>
      <email>kim@soundgarden.com</email>
      <phone>206.123.4567</phone>
    </contact>
    <program-info>
      <major>Music</major>
      <minor>Criminal Justice</minor>
      <advisor>Chris Cornell</advisor>
    </program-info>
    <academics-info>
      <id>8302438</id>
      <GPA>3.0</GPA>
      <progression-status>second year</progression-status>
      <status>full-time</status>
      <intial-enrollment>08-25-1978</intial-enrollment>
      <graduation-date>05-01-1982</graduation-date>
    </academics-info>
  </student>
</university>
